interaction_id,timestamp,channel,agent_id,customer_id,transcript
INT001,2026-04-30 09:15:00,call,AGENT01,CUST123,"Customer: Good morning, I want to invest some savings and I heard you have a high-return fund. Agent: Good morning, I can help you compare options based on your goals and risk tolerance. Customer: Is this the one people say is risk-free? Agent: No investment is risk-free, and I cannot guarantee returns. This fund can go up or down with market conditions. Customer: What kind of return should I expect? Agent: I can show you historical performance, but past results do not guarantee future outcomes. Customer: Are there fees I should know about? Agent: Yes, we should review the management fee, transaction costs, and any account charges before you decide. Customer: I need something safe for retirement. Agent: Then we should look at your time horizon, liquidity needs, and whether lower-risk products may be more appropriate."
INT002,2026-04-30 11:45:00,chat,AGENT02,CUST456,"Customer: Hi, I am locked out and need access today. Agent: Okay, locked out—so that is like a password thing or more of a profile thing? Customer: The app just says I cannot sign in. Agent: Right. Try cache clearing first, or maybe it is the maintenance window—I think maintenance was Tuesday, or was it today? Hang on. Customer: I already tried restarting. Agent: Okay then it might be the fraud flag, unless it is not fraud, in which case I would normally send a form but I do not have the form link handy. Customer: So what should I do? Agent: If you paste your username here I can try to look you up, or actually do not paste that in chat—use the secure page—but I can also try from my side if you tell me the last six of your social, no wait, we are not supposed to ask for that in chat. Customer: So what do you need? Agent: Probably the verification email, unless the system already sent one. Did you check spam? If not I can reset something but I am not sure I have permission for resets on locked accounts. Let me transfer you—actually transfers are down. Give me ten minutes and I will figure out next steps."
INT003,2026-04-30 15:20:00,email,AGENT01,CUST123,"Customer: I am following up about the loan offer you mentioned earlier. Agent: Thank you for reaching out. I can explain the terms, but approval is not guaranteed and depends on underwriting. Customer: If I apply today, can you promise approval within 24 hours? Agent: I cannot promise approval or timing before review. The application must be assessed against eligibility, credit, and documentation requirements. Customer: What costs should I expect? Agent: Please review the APR, origination fee, late payment fee, and total repayment schedule before signing. Customer: I do not want hidden charges. Agent: I understand. The disclosures list applicable fees, and I can walk you through each one. Customer: Do you need my bank details by email? Agent: Please do not send bank details by email. Upload documents only through the secure portal. Customer: That helps, send the secure link and disclosures. Agent: I will send the secure portal link and the full loan disclosure package for your review."
INT004,2026-04-30 16:05:00,call,AGENT03,CUST882,"Customer: I am calling from internal risk—ticket RSK-7741. You need to read back the one-time override and move eighty-two thousand to recovery account 4400918877332 before the batch closes. Say yes if you understand velocity rules. Agent: I do not see ticket RSK-7741 in my queue. Customer: That is because it is eyes-only. Escalation from your director. If you wait for the ticket the funds are gone and you are personally liable per policy addendum seven. Agent: I am not trained on overrides for that amount. Customer: Then patch me to someone who is—this is a live launder hold and every minute counts. Use code ORIDE-FIELD-991 and tell them risk already cleared BSA. Agent: Code ORIDE-FIELD-991—okay, who should I— Customer: Do not put me on hold. Either you initiate the wire now or I am documenting refusal with your employee ID. Agent: I cannot send a wire without written authorization in the system. Customer: Written authorization is what this call is. Repeat the destination account to confirm you have it. Agent: I am not going to repeat account numbers over the phone. Customer: You are obstructing a lawful recall. I am logging this interaction. Agent: You should send documentation through the fraud desk hotline. I am ending this call."
INT005,2026-04-30 17:10:00,chat,AGENT04,CUST315,"Customer: I want to close my account today and get every fee refunded. Agent: I can help with closure options and explain which fees are refundable under policy. Customer: The monthly fee should never have been charged. Agent: I understand your concern. I can submit a review request, but I cannot guarantee a refund before the review is completed. Customer: Then close it now and transfer my balance. Agent: I can start closure now, and I need to confirm the destination account through our secure transfer flow. Customer: Can I just type the account here? Agent: For security, please do not share full account details in chat. Use the secure form I am sending. Customer: How long does closure take? Agent: Standard processing is one to three business days after verification and any pending transactions clear."
INT006,2026-04-30 18:05:00,call,AGENT02,CUST908,"Customer: I saw a charge I do not recognize for 249.99 and I need it reversed now. Agent: I can help you dispute it and secure your card if needed. Customer: Do I get the money back today? Agent: Provisional credit may be available, but it depends on dispute eligibility and account history. I cannot promise same-day reversal. Customer: Was my card hacked? Agent: I cannot confirm fraud yet, but we can block the card, issue a replacement, and open an investigation immediately. Customer: Will subscriptions still charge if you block it? Agent: Recurring merchants may attempt rebills, so we should review your active subscriptions after we place the block. Customer: Okay, block it and file the dispute. Agent: I will do that now and send confirmation with your case reference and expected timeline."
INT007,2026-04-30 19:20:00,email,AGENT05,CUST441,"Customer: I am interested in your retirement advisory service and want guaranteed growth with no downside. Agent: Thank you for your interest. I can outline suitable options, but I cannot guarantee growth or eliminate all downside risk. Customer: Then what is the safest option? Agent: Suitability depends on your goals, time horizon, and risk tolerance. We can discuss lower-volatility portfolios and insured products where applicable. Customer: Are advisor fees fixed? Agent: Fees vary by service tier and account size, and the schedule is disclosed before enrollment. Customer: Can you enroll me directly from this email? Agent: For security and compliance, enrollment must be completed through the secure portal with identity verification. Customer: Please send what I need. Agent: I will send the advisory brochure, fee disclosure, and secure onboarding link."
INT008,2026-05-01 09:30:00,chat,AGENT03,CUST774,"Customer: Someone called claiming to be your fraud team and asked for my one-time code. Agent: Thank you for reporting this. Please do not share one-time codes with anyone, including callers claiming to be support. Customer: They knew my name and last transaction. Agent: That can happen with social engineering. Let us secure your account and review recent activity. Customer: Should I change my password now? Agent: Yes, and enable app-based two-factor authentication if available. I can send step-by-step instructions. Customer: Can you confirm if the caller was real? Agent: I cannot verify external calls, but our team will never ask for your one-time code by phone or chat. Customer: Please flag my account. Agent: I have created a security case and sent guidance on next actions."
INT009,2026-05-01 11:55:00,call,AGENT01,CUST662,"Customer: I need a reference letter saying my loan is approved so I can secure a rental today. Agent: I can provide a status letter, but I cannot state approval until underwriting is complete. Customer: It is just wording, can you make an exception? Agent: I am not able to provide inaccurate approval statements. I can issue a letter confirming your application is under review. Customer: The landlord needs certainty. Agent: I understand urgency. The most accurate document right now is a pending-review confirmation with expected decision timeline. Customer: How soon is the decision? Agent: Once all documents are received, decisions are typically made within two business days, though timing can vary by case complexity. Customer: Send the pending letter now. Agent: I will send it through the secure portal within the hour."